{
  "schemaVersion": "promotion-trust-vite-binding-v1",
  "bindingId": "promotion-trust-vite-binding-v1",
  "mode": "lossless-identifier-alias-v1",
  "stageA": {
    "releaseSha": "fecf6bb8e5dfa7cc69f9766f72ac6f5b9301dad9",
    "contractSet": {
      "path": "learning/contracts/learning-contract-set-v1.json",
      "sha256": "92aaf9a573f5d23b5bf5d8d7db1e68150d4b0944f0e6ab6e651b1a3d34408638"
    },
    "promotionManifest": {
      "path": "learning/manifests/promotion-trust-v1.json",
      "sha256": "553b97ed5dc44b77564ae50b1a2211205cbd1a759f3578e5e4dfcefef99044ac"
    }
  },
  "issue7": {
    "mergeSha": "1806b6d515f2f7a2ace2be7077af84a745ff221f",
    "adr": {
      "path": "docs/decisions/0005-web-stack.md",
      "sha256": "6e26c48a027d226d8529fda939c07cca99e9f4e1d88cac12708deb98d6fe5eee"
    },
    "package": {
      "path": "spikes/web/candidates/vite/package.json",
      "sha256": "c80eab653ba83702e37dc41d19f18408714863bbb4c5e4d5d7e2da66a7f1b871"
    },
    "lock": {
      "path": "spikes/web/candidates/vite/package-lock.json",
      "sha256": "96feead881be424d4c0d8d4629d7da0312722a3d7c945d08ed071542ea5d443c"
    },
    "lessonContract": {
      "path": "spikes/web/candidates/vite/src/lesson-contract.mjs",
      "sha256": "32b19a5f2e25bd805f340917071c7935a70ae27397b366ca34f1a89054fc35d9"
    }
  },
  "fixture": {
    "use": "build-time-validation-only",
    "evidence": {
      "path": "tests/fixtures/learning/promotion-trust/evidence-v1.json",
      "sha256": "2f4d90228fa2ea8859a8db630ff587b6cebdc10a0bf6b7db25e46c3dc27181d5"
    },
    "manifest": {
      "path": "tests/fixtures/learning/promotion-trust/manifest.json",
      "sha256": "0a1dcd4023648f52009bfd4dc5d529c00ce66f42cd0e725732b972b0b78df341"
    }
  },
  "grainBindings": [
    {
      "stageAGrain": "promotion",
      "viteGrain": "promotion",
      "stageAKeys": [
        "promo_name",
        "channel"
      ],
      "viteKeys": [
        "promo_name",
        "channel"
      ],
      "aliases": [
        {
          "from": "promo_name",
          "to": "promo_name",
          "kind": "identity"
        },
        {
          "from": "channel",
          "to": "channel",
          "kind": "identity"
        }
      ]
    },
    {
      "stageAGrain": "fulfillment",
      "viteGrain": "fulfillment",
      "stageAKeys": [
        "carrier",
        "region"
      ],
      "viteKeys": [
        "carrier",
        "region_name"
      ],
      "aliases": [
        {
          "from": "carrier",
          "to": "carrier",
          "kind": "identity"
        },
        {
          "from": "region",
          "to": "region_name",
          "kind": "identifier-alias"
        }
      ]
    },
    {
      "stageAGrain": "returns",
      "viteGrain": "returns",
      "stageAKeys": [
        "reason",
        "category",
        "region"
      ],
      "viteKeys": [
        "reason",
        "category_name",
        "region_name"
      ],
      "aliases": [
        {
          "from": "reason",
          "to": "reason",
          "kind": "identity"
        },
        {
          "from": "category",
          "to": "category_name",
          "kind": "identifier-alias"
        },
        {
          "from": "region",
          "to": "region_name",
          "kind": "identifier-alias"
        }
      ]
    },
    {
      "stageAGrain": "dq",
      "viteGrain": "data-quality",
      "stageAKeys": [
        "scenario"
      ],
      "viteKeys": [
        "scenario"
      ],
      "aliases": [
        {
          "from": "scenario",
          "to": "scenario",
          "kind": "identity"
        }
      ]
    }
  ],
  "decision": "insufficient-evidence/no-common-grain",
  "trustBoundary": {
    "browserRole": "projection-only",
    "serverValidationAuthority": "stage-a-learning-contracts",
    "completionAuthority": "learning-progress-authority-v1",
    "authorize": false,
    "mutate": false,
    "validate": false,
    "complete": false,
    "emitEvidence": false
  }
}
